id,Rows_Timeline Chart,Columns_Timeline Chart,Category,Date_Born,Full Name,Gender,Id,Is Recipient Active,Table Name_Award Only,Table Name_Birth Death,Born country,Date_Award,Date_Died,Date_Earliest,Date_End,First Name,Last Name,Motivation,Motivaton_Cleaned,Table Name,Age (Years) at Award,Decade_Born,Year,Born_Country_Latitude,Born_Country_Longitude,Born_Country_coordinates,continent
1,0,9979,Physics,Mar 1845,Wilhelm Conrad Röntgen,Male,1,Deceased,Start,Start,Prussia (now Germany),Dec 1901,Feb 1923,Nov 1817,Feb 1923,Wilhelm Conrad,Röntgen,"""in recognition of the extraordinary services he has rendered by the discovery of the remarkable rays subsequently named after him""",in recognition of the extraordinary services he has rendered by the discovery of the remarkable rays subsequently named after him,Start,56,1840,1901,51.165691,10.451526,"51.165691, 10.451526",Europe
2,0,13014,Physics,Jul 1853,Hendrik A. Lorentz,Male,2,Deceased,Start,Start,Netherlands,Dec 1902,Feb 1928,Nov 1817,Feb 1928,Hendrik A.,Lorentz,"""in recognition of the extraordinary service they rendered by their researches into the influence of magnetism upon radiation phenomena""",in recognition of the extraordinary service they rendered by their researches into the influence of magnetism upon radiation phenomena,Start,49,1850,1902,52.132633,5.291265999999999,"52.132633, 5.291265999999999",Europe
3,0,17343,Physics,May 1865,Pieter Zeeman,Male,3,Deceased,Start,Start,Netherlands,Dec 1902,Oct 1943,Nov 1817,Oct 1943,Pieter,Zeeman,"""in recognition of the extraordinary service they rendered by their researches into the influence of magnetism upon radiation phenomena""",in recognition of the extraordinary service they rendered by their researches into the influence of magnetism upon radiation phenomena,Start,37,1860,1902,52.132633,5.291265999999999,"52.132633, 5.291265999999999",Europe
4,0,12799,Physics,Dec 1852,Henri Becquerel,Male,4,Deceased,Start,Start,France,Dec 1903,Aug 1908,Nov 1817,Aug 1908,Henri,Becquerel,"""in recognition of the extraordinary services he has rendered by his discovery of spontaneous radioactivity""",in recognition of the extraordinary services he has rendered by his discovery of spontaneous radioactivity,Start,51,1850,1903,46.227638,2.213749,"46.227638, 2.213749",Europe
5,0,15141,Physics,May 1859,Pierre Curie,Male,5,Deceased,Start,Start,France,Dec 1903,Apr 1906,Nov 1817,Apr 1906,Pierre,Curie,"""in recognition of the extraordinary services they have rendered by their joint researches on the radiation phenomena discovered by Professor Henri Becquerel""",in recognition of the extraordinary services they have rendered by their joint researches on the radiation phenomena discovered by Professor Henri Becquerel,Start,44,1850,1903,46.227638,2.213749,"46.227638, 2.213749",Europe
6,0,18239,Physics,Nov 1867,Marie Curie,Female,6,Deceased,Start,Start,Russian Empire (now Poland),Dec 1903,Jul 1934,Nov 1817,Jul 1934,Marie,Curie,"""in recognition of the extraordinary services they have rendered by their joint researches on the radiation phenomena discovered by Professor Henri Becquerel""",in recognition of the extraordinary services they have rendered by their joint researches on the radiation phenomena discovered by Professor Henri Becquerel,Start,36,1860,1903,51.919438,19.145136,"51.919438, 19.145136",Europe
7,0,18239,Chemistry,Nov 1867,Marie Curie,Female,6,Deceased,Start,Start,Russian Empire (now Poland),Dec 1911,Jul 1934,Nov 1817,Jul 1934,Marie,Curie,"""in recognition of her services to the advancement of chemistry by the discovery of the elements radium and polonium by the isolation of radium and the study of the nature and compounds of this remarkable element""",in recognition of her services to the advancement of chemistry by the discovery of the elements radium and polonium by the isolation of radium and the study of the nature and compounds of this remarkable element,Start,44,1860,1911,51.919438,19.145136,"51.919438, 19.145136",Europe
8,0,9113,Physics,Nov 1842,Lord Rayleigh,Male,8,Deceased,Start,Start,United Kingdom,Dec 1904,Jun 1919,Nov 1817,Jun 1919,Lord,Rayleigh,"""for his investigations of the densities of the most important gases and for his discovery of argon in connection with these studies""",for his investigations of the densities of the most important gases and for his discovery of argon in connection with these studies,Start,62,1840,1904,55.378051,-3.435973,"55.378051, -3.435973",Europe
9,0,16260,Physics,Jun 1862,Philipp Lenard,Male,9,Deceased,Start,Start,Hungary (now Slovakia),Dec 1905,May 1947,Nov 1817,May 1947,Philipp,Lenard,"""for his work on cathode rays""",for his work on cathode rays,Start,43,1860,1905,48.669026,19.699024,"48.669026, 19.699024",Europe
10,0,14263,Physics,Dec 1856,J.J. Thomson,Male,10,Deceased,Start,Start,United Kingdom,Dec 1906,Aug 1940,Nov 1817,Aug 1940,J.J.,Thomson,"""in recognition of the great merits of his theoretical and experimental investigations on the conduction of electricity by gases""",in recognition of the great merits of his theoretical and experimental investigations on the conduction of electricity by gases,Start,50,1850,1906,55.378051,-3.435973,"55.378051, -3.435973",Europe
11,0,12803,Physics,Dec 1852,Albert A. Michelson,Male,11,Deceased,Start,Start,Prussia (now Poland),Dec 1907,May 1931,Nov 1817,May 1931,Albert A.,Michelson,"""for his optical precision instruments and the spectroscopic and metrological investigations carried out with their aid""",for his optical precision instruments and the spectroscopic and metrological investigations carried out with their aid,Start,55,1850,1907,51.919438,19.145136,"51.919438, 19.145136",Europe
12,0,10121,Physics,Aug 1845,Gabriel Lippmann,Male,12,Deceased,Start,Start,Luxembourg,Dec 1908,Jul 1921,Nov 1817,Jul 1921,Gabriel,Lippmann,"""for his method of reproducing colours photographically based on the phenomenon of interference""",for his method of reproducing colours photographically based on the phenomenon of interference,Start,63,1840,1908,49.815273,6.129582999999999,"49.815273, 6.129582999999999",Europe
13,0,20600,Physics,Apr 1874,Guglielmo Marconi,Male,13,Deceased,Start,Start,Italy,Dec 1909,Jul 1937,Nov 1817,Jul 1937,Guglielmo,Marconi,"""in recognition of their contributions to the development of wireless telegraphy""",in recognition of their contributions to the development of wireless telegraphy,Start,35,1870,1909,41.87194,12.56738,"41.87194, 12.56738",Europe
14,0,11876,Physics,Jun 1850,Ferdinand Braun,Male,14,Deceased,Start,Start,Hesse-Kassel (now Germany),Dec 1909,Apr 1918,Nov 1817,Apr 1918,Ferdinand,Braun,"""in recognition of their contributions to the development of wireless telegraphy""",in recognition of their contributions to the development of wireless telegraphy,Start,59,1850,1909,51.3127114,9.4797461,"51.3127114, 9.4797461",Europe
15,0,7298,Physics,Nov 1837,Johannes Diderik van der Waals,Male,15,Deceased,Start,Start,Netherlands,Dec 1910,Mar 1923,Nov 1817,Mar 1923,Johannes Diderik,van der Waals,"""for his work on the equation of state for gases and liquids""",for his work on the equation of state for gases and liquids,Start,73,1830,1910,52.132633,5.291265999999999,"52.132633, 5.291265999999999",Europe
16,0,16845,Physics,Jan 1864,Wilhelm Wien,Male,16,Deceased,Start,Start,Prussia (now Russia),Dec 1911,Aug 1928,Nov 1817,Aug 1928,Wilhelm,Wien,"""for his discoveries regarding the laws governing the radiation of heat""",for his discoveries regarding the laws governing the radiation of heat,Start,47,1860,1911,61.52401,105.318756,"61.52401, 105.318756",Asia
17,0,18993,Physics,Nov 1869,Gustaf Dalén,Male,17,Deceased,Start,Start,Sweden,Dec 1912,Dec 1937,Nov 1817,Dec 1937,Gustaf,Dalén,"""for his invention of automatic regulators for use in conjunction with gas accumulators for illuminating lighthouses and buoys""",for his invention of automatic regulators for use in conjunction with gas accumulators for illuminating lighthouses and buoys,Start,43,1860,1912,60.12816100000001,18.643501,"60.12816100000001, 18.643501",Europe
18,0,13079,Physics,Sep 1853,Heike Kamerlingh Onnes,Male,18,Deceased,Start,Start,Netherlands,Dec 1913,Feb 1926,Nov 1817,Feb 1926,Heike,Kamerlingh Onnes,"""for his investigations on the properties of matter at low temperatures which led inter alia to the production of liquid helium""",for his investigations on the properties of matter at low temperatures which led inter alia to the production of liquid helium,Start,60,1850,1913,52.132633,5.291265999999999,"52.132633, 5.291265999999999",Europe
19,0,22593,Physics,Oct 1879,Max von Laue,Male,19,Deceased,Start,Start,Germany,Dec 1914,Apr 1960,Nov 1817,Apr 1960,Max,von Laue,"""for his discovery of the diffraction of X-rays by crystals""",for his discovery of the diffraction of X-rays by crystals,Start,35,1870,1914,51.165691,10.451526,"51.165691, 10.451526",Europe
20,0,16285,Physics,Jul 1862,William Bragg,Male,20,Deceased,Start,Start,United Kingdom,Dec 1915,Mar 1942,Nov 1817,Mar 1942,William,Bragg,"""for their services in the analysis of crystal structure by means of X-rays""",for their services in the analysis of crystal structure by means of X-rays,Start,53,1860,1915,55.378051,-3.435973,"55.378051, -3.435973",Europe
21,0,26419,Physics,Mar 1890,Lawrence Bragg,Male,21,Deceased,Start,Start,Australia,Dec 1915,Jul 1971,Nov 1817,Jul 1971,Lawrence,Bragg,"""for their services in the analysis of crystal structure by means of X-rays""",for their services in the analysis of crystal structure by means of X-rays,Start,25,1890,1915,-25.274398,133.775136,"-25.274398, 133.775136",Australia
22,0,21739,Physics,Jun 1877,Charles Glover Barkla,Male,22,Deceased,Start,Start,United Kingdom,Dec 1917,Oct 1944,Nov 1817,Oct 1944,Charles Glover,Barkla,"""for his discovery of the characteristic R&ouml;ntgen radiation of the elements""",for his discovery of the characteristic R&ouml;ntgen radiation of the elements,Start,40,1870,1917,55.378051,-3.435973,"55.378051, -3.435973",Europe
23,0,14754,Physics,Apr 1858,Max Planck,Male,23,Deceased,Start,Start,Schleswig (now Germany),Dec 1918,Oct 1947,Nov 1817,Oct 1947,Max,Planck,"""in recognition of the services he rendered to the advancement of Physics by his discovery of energy quanta""",in recognition of the services he rendered to the advancement of Physics by his discovery of energy quanta,Start,60,1850,1918,54.21936720000001,9.6961167,"54.21936720000001, 9.6961167",Europe
24,0,20590,Physics,Apr 1874,Johannes Stark,Male,24,Deceased,Start,Start,Germany,Dec 1919,Jun 1957,Nov 1817,Jun 1957,Johannes,Stark,"""for his discovery of the Doppler effect in canal rays and the splitting of spectral lines in electric fields""",for his discovery of the Doppler effect in canal rays and the splitting of spectral lines in electric fields,Start,45,1870,1919,51.165691,10.451526,"51.165691, 10.451526",Europe
25,0,15783,Physics,Feb 1861,Charles Edouard Guillaume,Male,25,Deceased,Start,Start,Switzerland,Dec 1920,Jun 1938,Nov 1817,Jun 1938,Charles Edouard,Guillaume,"""in recognition of the service he has rendered to precision measurements in Physics by his discovery of anomalies in nickel steel alloys""",in recognition of the service he has rendered to precision measurements in Physics by his discovery of anomalies in nickel steel alloys,Start,59,1860,1920,46.818188,8.227511999999999,"46.818188, 8.227511999999999",Europe
26,0,22384,Physics,Mar 1879,Albert Einstein,Male,26,Deceased,Start,Start,Germany,Dec 1921,Apr 1955,Nov 1817,Apr 1955,Albert,Einstein,"""for his services to Theoretical Physics and especially for his discovery of the law of the photoelectric effect""",for his services to Theoretical Physics and especially for his discovery of the law of the photoelectric effect,Start,42,1870,1921,51.165691,10.451526,"51.165691, 10.451526",Europe
27,0,24783,Physics,Oct 1885,Niels Bohr,Male,27,Deceased,Start,Start,Denmark,Dec 1922,Nov 1962,Nov 1817,Nov 1962,Niels,Bohr,"""for his services in the investigation of the structure of atoms and of the radiation emanating from them""",for his services in the investigation of the structure of atoms and of the radiation emanating from them,Start,37,1880,1922,56.26392,9.501785,"56.26392, 9.501785",Europe
28,0,18375,Physics,Mar 1868,Robert A. Millikan,Male,28,Deceased,Start,Start,USA,Dec 1923,Dec 1953,Nov 1817,Dec 1953,Robert A.,Millikan,"""for his work on the elementary charge of electricity and on the photoelectric effect""",for his work on the elementary charge of electricity and on the photoelectric effect,Start,55,1860,1923,37.09024,-95.712891,"37.09024, -95.712891",North America
29,0,25205,Physics,Dec 1886,Manne Siegbahn,Male,29,Deceased,Start,Start,Sweden,Dec 1924,Sep 1978,Nov 1817,Sep 1978,Manne,Siegbahn,"""for his discoveries and research in the field of X-ray spectroscopy""",for his discoveries and research in the field of X-ray spectroscopy,Start,38,1880,1924,60.12816100000001,18.643501,"60.12816100000001, 18.643501",Europe
30,0,23645,Physics,Aug 1882,James Franck,Male,30,Deceased,Start,Start,Germany,Dec 1925,May 1964,Nov 1817,May 1964,James,Franck,"""for their discovery of the laws governing the impact of an electron upon an atom""",for their discovery of the laws governing the impact of an electron upon an atom,Start,43,1880,1925,51.165691,10.451526,"51.165691, 10.451526",Europe
31,0,25436,Physics,Jul 1887,Gustav Hertz,Male,31,Deceased,Start,Start,Germany,Dec 1925,Oct 1975,Nov 1817,Oct 1975,Gustav,Hertz,"""for their discovery of the laws governing the impact of an electron upon an atom""",for their discovery of the laws governing the impact of an electron upon an atom,Start,38,1880,1925,51.165691,10.451526,"51.165691, 10.451526",Europe
32,0,19297,Physics,Sep 1870,Jean Baptiste Perrin,Male,32,Deceased,Start,Start,France,Dec 1926,Apr 1942,Nov 1817,Apr 1942,Jean Baptiste,Perrin,"""for his work on the discontinuous structure of matter and especially for his discovery of sedimentation equilibrium""",for his work on the discontinuous structure of matter and especially for his discovery of sedimentation equilibrium,Start,56,1870,1926,46.227638,2.213749,"46.227638, 2.213749",Europe
33,0,27313,Physics,Sep 1892,Arthur H. Compton,Male,33,Deceased,Start,Start,USA,Dec 1927,Mar 1962,Nov 1817,Mar 1962,Arthur H.,Compton,"""for his discovery of the effect named after him""",for his discovery of the effect named after him,Start,35,1890,1927,37.09024,-95.712891,"37.09024, -95.712891",North America
34,0,18704,Physics,Feb 1869,C.T.R. Wilson,Male,34,Deceased,Start,Start,Scotland,Dec 1927,Nov 1959,Nov 1817,Nov 1959,C.T.R.,Wilson,"""for his method of making the paths of electrically charged particles visible by condensation of vapour""",for his method of making the paths of electrically charged particles visible by condensation of vapour,Start,58,1860,1927,56.49067119999999,-4.2026458,"56.49067119999999, -4.2026458",Europe
35,0,22427,Physics,Apr 1879,Owen Willans Richardson,Male,35,Deceased,Start,Start,United Kingdom,Dec 1928,Feb 1959,Nov 1817,Feb 1959,Owen Willans,Richardson,"""for his work on the thermionic phenomenon and especially for the discovery of the law named after him""",for his work on the thermionic phenomenon and especially for the discovery of the law named after him,Start,49,1870,1928,55.378051,-3.435973,"55.378051, -3.435973",Europe
36,0,27287,Physics,Aug 1892,Louis de Broglie,Male,36,Deceased,Start,Start,France,Dec 1929,Mar 1987,Nov 1817,Mar 1987,Louis,de Broglie,"""for his discovery of the wave nature of electrons""",for his discovery of the wave nature of electrons,Start,37,1890,1929,46.227638,2.213749,"46.227638, 2.213749",Europe
37,0,25910,Physics,Nov 1888,Sir Chandrasekhara Venkata Raman,Male,37,Deceased,Start,Start,India,Dec 1930,Nov 1970,Nov 1817,Nov 1970,Sir Chandrasekhara Venkata,Raman,"""for his work on the scattering of light and for the discovery of the effect named after him""",for his work on the scattering of light and for the discovery of the effect named after him,Start,42,1880,1930,20.593684,78.96288,"20.593684, 78.96288",Asia
38,0,30685,Physics,Dec 1901,Werner Heisenberg,Male,38,Deceased,Start,Start,Germany,Dec 1932,Feb 1976,Nov 1817,Feb 1976,Werner,Heisenberg,"""for the creation of quantum mechanics the application of which has inter alia led to the discovery of the allotropic forms of hydrogen""",for the creation of quantum mechanics the application of which has inter alia led to the discovery of the allotropic forms of hydrogen,Start,31,1900,1932,51.165691,10.451526,"51.165691, 10.451526",Europe
39,0,25457,Physics,Aug 1887,Erwin Schrödinger,Male,39,Deceased,Start,Start,Austria,Dec 1933,Jan 1961,Nov 1817,Jan 1961,Erwin,Schrödinger,"""for the discovery of new productive forms of atomic theory""",for the discovery of new productive forms of atomic theory,Start,46,1880,1933,47.516231,14.550072,"47.516231, 14.550072",Europe
40,0,30931,Physics,Aug 1902,Paul A.M. Dirac,Male,40,Deceased,Start,Start,United Kingdom,Dec 1933,Oct 1984,Nov 1817,Oct 1984,Paul A.M.,Dirac,"""for the discovery of new productive forms of atomic theory""",for the discovery of new productive forms of atomic theory,Start,31,1900,1933,55.378051,-3.435973,"55.378051, -3.435973",Europe
41,0,26987,Physics,Oct 1891,James Chadwick,Male,41,Deceased,Start,Start,United Kingdom,Dec 1935,Jul 1974,Nov 1817,Jul 1974,James,Chadwick,"""for the discovery of the neutron""",for the discovery of the neutron,Start,44,1890,1935,55.378051,-3.435973,"55.378051, -3.435973",Europe
42,0,23947,Physics,Jun 1883,Victor F. Hess,Male,42,Deceased,Start,Start,Austria,Dec 1936,Dec 1964,Nov 1817,Dec 1964,Victor F.,Hess,"""for his discovery of cosmic radiation""",for his discovery of cosmic radiation,Start,53,1880,1936,47.516231,14.550072,"47.516231, 14.550072",Europe
43,0,32053,Physics,Sep 1905,Carl D. Anderson,Male,43,Deceased,Start,Start,USA,Dec 1936,Jan 1991,Nov 1817,Jan 1991,Carl D.,Anderson,"""for his discovery of the positron""",for his discovery of the positron,Start,31,1900,1936,37.09024,-95.712891,"37.09024, -95.712891",North America
44,0,23337,Physics,Oct 1881,Clinton Davisson,Male,44,Deceased,Start,Start,USA,Dec 1937,Feb 1958,Nov 1817,Feb 1958,Clinton,Davisson,"""for their experimental discovery of the diffraction of electrons by crystals""",for their experimental discovery of the diffraction of electrons by crystals,Start,56,1880,1937,37.09024,-95.712891,"37.09024, -95.712891",North America
45,0,27183,Physics,May 1892,George Paget Thomson,Male,45,Deceased,Start,Start,United Kingdom,Dec 1937,Sep 1975,Nov 1817,Sep 1975,George Paget,Thomson,"""for their experimental discovery of the diffraction of electrons by crystals""",for their experimental discovery of the diffraction of electrons by crystals,Start,45,1890,1937,55.378051,-3.435973,"55.378051, -3.435973",Europe
46,0,30618,Physics,Sep 1901,Enrico Fermi,Male,46,Deceased,Start,Start,Italy,Dec 1938,Nov 1954,Nov 1817,Nov 1954,Enrico,Fermi,"""for his demonstrations of the existence of new radioactive elements produced by neutron irradiation and for his related discovery of nuclear reactions brought about by slow neutrons""",for his demonstrations of the existence of new radioactive elements produced by neutron irradiation and for his related discovery of nuclear reactions brought about by slow neutrons,Start,37,1900,1938,41.87194,12.56738,"41.87194, 12.56738",Europe
47,0,30566,Physics,Aug 1901,Ernest Lawrence,Male,47,Deceased,Start,Start,USA,Dec 1939,Aug 1958,Nov 1817,Aug 1958,Ernest,Lawrence,"""for the invention and development of the cyclotron and for results obtained with it especially with regard to artificial radioactive elements""",for the invention and development of the cyclotron and for results obtained with it especially with regard to artificial radioactive elements,Start,38,1900,1939,37.09024,-95.712891,"37.09024, -95.712891",North America
48,0,25646,Physics,Feb 1888,Otto Stern,Male,48,Deceased,Start,Start,Germany (now Poland),Dec 1943,Aug 1969,Nov 1817,Aug 1969,Otto,Stern,"""for his contribution to the development of the molecular ray method and his discovery of the magnetic moment of the proton""",for his contribution to the development of the molecular ray method and his discovery of the magnetic moment of the proton,Start,55,1880,1943,51.919438,19.145136,"51.919438, 19.145136",Europe
49,0,29461,Physics,Jul 1898,Isidor Isaac Rabi,Male,49,Deceased,Start,Start,Austria-Hungary (now Poland),Dec 1944,Jan 1988,Nov 1817,Jan 1988,Isidor Isaac,Rabi,"""for his resonance method for recording the magnetic properties of atomic nuclei""",for his resonance method for recording the magnetic properties of atomic nuclei,Start,46,1890,1944,51.919438,19.145136,"51.919438, 19.145136",Europe
50,0,30096,Physics,Apr 1900,Wolfgang Pauli,Male,50,Deceased,Start,Start,Austria,Dec 1945,Dec 1958,Nov 1817,Dec 1958,Wolfgang,Pauli,"""for the discovery of the Exclusion Principle also called the Pauli Principle""",for the discovery of the Exclusion Principle also called the Pauli Principle,Start,45,1900,1945,47.516231,14.550072,"47.516231, 14.550072",Europe
51,0,23518,Physics,Apr 1882,Percy W. Bridgman,Male,51,Deceased,Start,Start,USA,Dec 1946,Aug 1961,Nov 1817,Aug 1961,Percy W.,Bridgman,"""for the invention of an apparatus to produce extremely high pressures and for the discoveries he made therewith in the field of high pressure physics""",for the invention of an apparatus to produce extremely high pressures and for the discoveries he made therewith in the field of high pressure physics,Start,64,1880,1946,37.09024,-95.712891,"37.09024, -95.712891",North America
52,0,27309,Physics,Sep 1892,Edward V. Appleton,Male,52,Deceased,Start,Start,United Kingdom,Dec 1947,Apr 1965,Nov 1817,Apr 1965,Edward V.,Appleton,"""for his investigations of the physics of the upper atmosphere especially for the discovery of the so-called Appleton layer""",for his investigations of the physics of the upper atmosphere especially for the discovery of the so-called Appleton layer,Start,55,1890,1947,55.378051,-3.435973,"55.378051, -3.435973",Europe
53,0,29208,Physics,Nov 1897,Patrick M.S. Blackett,Male,53,Deceased,Start,Start,United Kingdom,Dec 1948,Jul 1974,Nov 1817,Jul 1974,Patrick M.S.,Blackett,"""for his development of the Wilson cloud chamber method and his discoveries therewith in the fields of nuclear physics and cosmic radiation""",for his development of the Wilson cloud chamber method and his discoveries therewith in the fields of nuclear physics and cosmic radiation,Start,51,1890,1948,55.378051,-3.435973,"55.378051, -3.435973",Europe
54,0,32560,Physics,Jan 1907,Hideki Yukawa,Male,54,Deceased,Start,Start,Japan,Dec 1949,Sep 1981,Nov 1817,Sep 1981,Hideki,Yukawa,"""for his prediction of the existence of mesons on the basis of theoretical work on nuclear forces""",for his prediction of the existence of mesons on the basis of theoretical work on nuclear forces,Start,42,1900,1949,36.204824,138.252924,"36.204824, 138.252924",Asia
55,0,31415,Physics,Dec 1903,Cecil Powell,Male,55,Deceased,Start,Start,United Kingdom,Dec 1950,Aug 1969,Nov 1817,Aug 1969,Cecil,Powell,"""for his development of the photographic method of studying nuclear processes and his discoveries regarding mesons made with this method""",for his development of the photographic method of studying nuclear processes and his discoveries regarding mesons made with this method,Start,47,1900,1950,55.378051,-3.435973,"55.378051, -3.435973",Europe
56,0,29033,Physics,May 1897,John Cockcroft,Male,56,Deceased,Start,Start,United Kingdom,Dec 1951,Sep 1967,Nov 1817,Sep 1967,John,Cockcroft,"""for their pioneer work on the transmutation of atomic nuclei by artificially accelerated atomic particles""",for their pioneer work on the transmutation of atomic nuclei by artificially accelerated atomic particles,Start,54,1890,1951,55.378051,-3.435973,"55.378051, -3.435973",Europe
57,0,31355,Physics,Oct 1903,Ernest T.S. Walton,Male,57,Deceased,Start,Start,Ireland,Dec 1951,Jun 1995,Nov 1817,Jun 1995,Ernest T.S.,Walton,"""for their pioneer work on the transmutation of atomic nuclei by artificially accelerated atomic particles""",for their pioneer work on the transmutation of atomic nuclei by artificially accelerated atomic particles,Start,48,1900,1951,53.77975540000001,-7.3055309,"53.77975540000001, -7.3055309",Europe
58,0,32103,Physics,Oct 1905,Felix Bloch,Male,58,Deceased,Start,Start,Switzerland,Dec 1952,Sep 1983,Nov 1817,Sep 1983,Felix,Bloch,"""for their development of new methods for nuclear magnetic precision measurements and discoveries in connection therewith""",for their development of new methods for nuclear magnetic precision measurements and discoveries in connection therewith,Start,47,1900,1952,46.818188,8.227511999999999,"46.818188, 8.227511999999999",Europe
59,0,34606,Physics,Aug 1912,E. M. Purcell,Male,59,Deceased,Start,Start,USA,Dec 1952,Mar 1997,Nov 1817,Mar 1997,E. M.,Purcell,"""for their development of new methods for nuclear magnetic precision measurements and discoveries in connection therewith""",for their development of new methods for nuclear magnetic precision measurements and discoveries in connection therewith,Start,40,1910,1952,37.09024,-95.712891,"37.09024, -95.712891",North America
60,0,25796,Physics,Jul 1888,Frits Zernike,Male,60,Deceased,Start,Start,Netherlands,Dec 1953,Mar 1966,Nov 1817,Mar 1966,Frits,Zernike,"""for his demonstration of the phase contrast method especially for his invention of the phase contrast microscope""",for his demonstration of the phase contrast method especially for his invention of the phase contrast microscope,Start,65,1880,1953,52.132633,5.291265999999999,"52.132633, 5.291265999999999",Europe
